stack_no,source_file,source_reference,part,dimension_name,selected_value_basis,nominal_mm,plus_mm,minus_mm,lower_mm,upper_mm,sign,status,reason,stackup_use
1,AS2159-Washer.pdf,"PPT slide 4 / AS2159 table, column C (washer thickness). Extracted table values show ST2159 washer thickness rows.",Washer,Washer thickness C,AS2159 washer table; assembly washer exact dash number not specified in diagram. Use matching project washer row after engineer confirmation.,,,,,,-1,needs_dash_number_confirmation,Washer axial thickness reduces bolt protrusion.,needs_confirmation_before_calculation
2,5377631-01-Rare_case.pdf,PPT slide 4 / rear case drawing label 2,Rear case / flange side,Flange/interface axial offset 8.76 +/-0.13,Visible in PPT image7 and extracted from 5377632 page as D2; verify drawing ownership because PPT slide associates label 2 with 5377631-01.,8.76,0.13,0.13,8.63,8.89,-1,verify_source_file,Axial stack thickness contributor at flange interface.,needs_confirmation_before_calculation
3,5377630-01-Front_case.pdf,PPT slide 4 / front case drawing label 3,Front case / flange side,Flange/interface axial offset 5.08 +/-0.13,Visible in PPT image6 and extracted as Front_case D5.,5.08,0.13,0.13,4.95,5.21,-1,selected,Axial stack thickness contributor at flange interface.,use_after_engineer_review
4,5377632-R10AS.pdf,PPT slide 4 / R10AS drawing label 4,R10AS / bracket,Axial offset 6.35 +/-0.13,Visible in PPT image8.,6.35,0.13,0.13,6.22,6.48,-1,selected,Axial stack thickness contributor through bracket/flange region.,use_after_engineer_review
5,5377632-R10AS.pdf,PPT slide 4 / R10AS drawing label 5,R10AS / bracket,Axial offset 6.10 +/-0.13,Visible in PPT image8.,6.1,0.13,0.13,5.97,6.23,-1,selected,Axial stack thickness contributor through bracket/flange region.,use_after_engineer_review
6,AS3580-Bolt.pdf,"PPT slide 5 / AS3580 table, selected AS3580-5-22 row",Bolt,Bolt length L,PPT image12 table: AS3580-5-22 L=1.375 +/-0.010 in = 34.925 +/-0.254 mm.,34.925,0.254,0.254,34.671,35.179,1,selected,Bolt length increases protrusion.,use_after_engineer_review
7,ST2780-Nut.pdf,"PPT slide 5 / ST2780 optional nut table, selected ST2780-09 row",Nut,Nut height H,PPT image11 table: ST2780-09 H=.150-.190 in = 3.810-4.826 mm.,4.318,0.508,0.508,3.8099999999999996,4.826,-1,selected_optional_nut,Nut axial height consumes bolt length before visible protrusion.,use_after_engineer_review
8,CICR_CI-CICR-SDCI-P30-JB-PH-02-FR-E / UG measurement,PPT slide 5 note: chamfer length measured from UG,Interface chamfer,Chamfer length from UG,Not present as a reliable drawing-table extraction. Needs UG/CAD measurement input.,,,,,,,requires_UG_measurement,Chamfer correction affects effective protrusion measurement plane.,needs_confirmation_before_calculation
